{"run_at":"2026-10-26T00:36:50Z","source":"linkedin","added":[{"company":"Hader Solutions","title":"Manufacturing Safety, Health, and Environmental Specialist","location":"Medford, WI","url":"https://www.linkedin.com/jobs/view/4482908492/","date_posted":"2026-10-26","salary":"","ats":"LinkedIn","remote_query":true,"description":"Role:\nSafety Health & Environmental Specialist\n\nResponsibilities Include\n\nLeading EHS programs to ensure a safe, compliant, and sustainable work environment\nConducting risk assessments and safety audits to identify and mitigate hazards\nInvestigating incidents and implementing corrective actions\nDelivering safety and environmental training to staff\nManaging regulatory documentation, permits, and compliance requirements\nPartnering with plant operations to embed safe work practices and support sustainability initiatives\nReducing waste and fostering a strong safety culture across all shifts and teams\n\nQualifications And Skills\n\nKnowledge of safety, health, and environmental regulations\nStrong audit, investigation, and risk assessment skills\nExcellent communication and training abilities\nAbility to collaborate effectively with cross-functional teams\nCommitment to safety, sustainability, and continuous improvement\n\nShow more\n\nShow less\n\nSeniority level\n\nNot Applicable\n\nEmployment type\n\nFull-time\n\nIndustries\n\nBusiness Consulting and Services","first_seen":"2026-10-26T00:36:50Z"}],"updated":[]}