{"run_at":"2026-10-25T06:29:17Z","source":"linkedin","added":[{"company":"Trinity Health","title":"Medical Laboratory Scientist - Toxicology","location":"Ann Arbor, MI","url":"https://www.linkedin.com/jobs/view/4483380109/","date_posted":"2026-10-25","salary":"","ats":"LinkedIn","remote_query":true,"description":"Employment Type:\nFull time Shift:\nDay Shift\nDescription:\nThe job encompasses instrument operation, specimen preparation for analysis, result reporting, and the use of laboratory information system. Basic knowledge and some experience in wet chemistry techniques are important. All testing is for patient care. Department:\nToxicology\nLocation:\nWarde Lab, 300 W Textile Rd. Ann Arbor, MI\nStatus\n: Full time, 40 hours a week\nShift:\nDay shift, approx. 7am start time\n\nThe opening is in the Toxicology section where clinical toxicology testing is performed. The specimens used for testing are urine and blood.\nCertification is not required.\n\nA bachelor of science in biological, chemical or medical technology is required.\n\nInstruments for testing are HPLC, LCMSMS and other chemistry analyzers. Experience in patient testing using these instruments is desirable, but not required.\n\nRequired Qualifications:\n\nEducation\n\nBaccalaureate degree from an accredited college, or university in Medical Technology or Medical Laboratory Science.\n- May consider a bachelor’s degree in science  with a combination of relevant work experience in a comparable laboratory setting\n. Proof of educational transcripts must be submitted at time of application.\n\nExperience\n\nRelevant work experience in a medical laboratory is required if MLS/MT degree is not obtained.\n\nCertification/Licensure\n\nMedical Technologist (MT)/Medical Laboratory Technician (MLT), Medical Laboratory Scientist (MLS) – ASCP, or NCLS certification preferred.\n\nApplicants for this position must be authorized to work for any employer in the U.S. We are unable to sponsor an employment visa for this position.\n\nThis position may also be listed as: Medical Lab Scientist, Medical Technologist, Clinical Laboratory Scientist\n\nWhat you will do:\n\nRecords and/or enters laboratory computer results of tests performed and advises supervisor spurious, unusual or highly abnormal results before release of results for reporting.\n\nReports results of tests ordered stat and highly abnormal or unexpected results in a timely manner and according to established policies and procedures.\n\nCompares test results with previous patient test results when indicated, calling attention of supervisor or pathologist to unusual fluctuations.\n\nPerforms required quality control and equipment maintenance and calibrates and operates laboratory equipment used in performance of the tests pertinent to the section) to which assigned.\n\nNotifies appropriate personnel of problems such as unacceptable specimens, equipment malfunctions, and quality control aberrations, in accordance with department policy on procedure.\n\nPrepares standards, reagents, and other materials used in testing.\n\nContacts nursing unit or client office personnel regarding results and for clarification of requests and other routine problems which may arise.\n\nOur Commitment\n\nRooted in our Mission and Core Values, we honor the dignity of every person and recognize the unique perspectives, experiences, and talents each colleague brings. By finding common ground and embracing our differences, we grow stronger together and deliver more compassionate, person-centered care. We are an Equal Opportunity Employer. All qualified applicants will receive consideration for employment without regard to race, color, religion, sex, sexual orientation, gender identity, national origin, disability, veteran status, or any other status protected by federal, state, or local law.\n\nShow more\n\nShow less\n\nSeniority level\n\nNot Applicable\n\nEmployment type\n\nFull-time\n\nIndustries\n\nHospitals and Health Care","first_seen":"2026-10-25T06:29:17Z","duplicate_urls":["https://www.linkedin.com/jobs/view/4483361843/"]}],"updated":[]}