{"run_at":"2026-10-29T20:35:33Z","source":"linkedin","added":[{"company":"JMT","title":"Water Resources Section Head","location":"Austin, Texas Metropolitan Area","url":"https://www.linkedin.com/jobs/view/4474085334/","date_posted":"2026-10-29","salary":"","ats":"LinkedIn","remote_query":true,"description":"Job Description\n\nJohnson, Mirmiran & Thompson is a dynamic, 100% employee-owned consulting firm with more than 2,800 professionals, providing a full range of multidisciplinary engineering, architecture, information technology, and related services to public agencies and private clients throughout the United States. JMT is currently ranked #45 on Engineering News-Record’s list of the Top 500 Design Firms.\n\nJMT is an employee-owned firm where people work together, support one another, and take pride in delivering meaningful results for our clients and communities. Our collaborative culture brings together the accountability of ownership, the technical depth of a multidisciplinary team, and the shared commitment to help our people and projects succeed.\n\nWhat You Will Help Us Build:\nIf you are a Senior Water Resources leader who enjoys developing people, shaping team culture, and helping a practice grow with purpose, this role offers an opportunity to make a visible impact. JMT is expanding its Water Resources leadership capacity across Texas and Colorado, and we are looking for a leader who can strengthen operations, mentor technical staff, support project delivery, and help position the practice for continued regional growth.\n\nWhy JMT:\nAt JMT, you will join an employee-owned firm where technical leadership, collaboration, and accountability are part of how we work. Our Water Resources practice is delivering a growing portfolio of transportation, municipal, drainage, floodplain, stormwater, and water quality projects, and we are looking for someone who wants to help guide that work while investing in the people behind it. This is a strong fit for a leader who values trust, mentorship, client service, and the chance to help build something lasting in key regional markets.\n\nPosition summary:\nThe Water Resources Section Head will lead staff, operations, client engagement, and delivery oversight for a growing regional practice. This position is responsible for developing people, managing workload and financial performance, supporting business development, and providing senior technical guidance across drainage, stormwater, floodplain, H&H, and water quality services.\n\nEssential Functions And Responsibilities\n\nLead, mentor, and develop Water Resources staff, including performance management, staffing needs, and career growth\nManage section operations, including workload planning, utilization, budgets, backlog, staffing forecasts, and financial performance\nSupport strategic growth planning for the Water Resources practice in coordination with regional and office leadership\nStrengthen client relationships and support business development with transportation, municipal, county, flood control, and stormwater clients\nLead or support pursuit strategy, proposals, interviews, and client presentations\nProvide senior technical leadership and quality oversight for drainage, hydrologic and hydraulic, stormwater, floodplain, and water quality projects\nAdvise project managers and technical staff on complex delivery, risk management, staffing, and client-service decisions\nPromote collaboration across offices and disciplines to deliver consistent, high-quality solutions\n\nNonessential Functions And Responsibilities\n\nPerform other related duties as assigned\n\nRequired Skills\n\nBachelor’s degree in civil engineering, water resources engineering, or a related field from an accredited program\nTexas Professional Engineer license or the ability to obtain licensure within 6 months of hire\n10+ years of progressively responsible water resources experience\nExperience in TxDOT drainage design for TxDOT transportation projects (or other DOTs)\nFamiliar with TxDOT Design Standards and the TxDOT Drainage Manual\nExperience with Open Roads Designer production and Open Roads Drainage and Utilities modeling\nExperience with HEC-RAS 1D and 2D roadway drainage applications and stormwater management design\nExperience in HEC-HMS software\nDemonstrated experience leading, supervising, mentoring, or developing technical staff\nExperience managing operations, project delivery, financial performance, workload planning, and client expectations\nExperience with business development, proposal development, client coordination, and pursuit strategy\nStrong leadership, communication, organizational, and decision-making skills\n\nQualifications Preferred\n\nExperience as responsible drainage task lead for complex H&H schematic and PS&E projects involving modeling, design, and drainage reports\nEstablished client relationships in Texas, Colorado, or similar regional markets\n2-D HEC-RAS, SWMM, ARC-GIS experience\nExperience with TxDOT, municipal, county, flood control, transportation, or stormwater clients\nTechnical background in drainage design, H&H modeling, floodplain studies, stormwater management, and water quality compliance\nExperience leading multidisciplinary teams across multiple offices or regions\nCertified Floodplain Manager certification or other relevant technical certification\n\nWorking Conditions\n\nWork is performed within a general office environment. Work is generally sedentary in nature, but may require occasional standing and walking. Lighting and temperature are adequate and there are no hazardous or unpleasant conditions caused by noise, dust, etc. within the office environment.\n\nQualified applicants will receive consideration for employment without regard to race, color, religion, sex, sexual orientation, gender identity, national origin, disability, protected veteran status or any other characteristic protected by state or federal law.\n\nShow more\n\nShow less\n\nSeniority level\n\nNot Applicable\n\nEmployment type\n\nFull-time\n\nIndustries\n\nCivil Engineering","first_seen":"2026-10-29T20:35:33Z"}],"updated":[]}