{"run_at":"2026-10-30T20:20:41Z","source":"linkedin","added":[{"company":"Monde Nissin Corporation","title":"Safety & Environmental Compliance Lead","location":"Santa Rosa City, Calabarzon, Philippines","url":"https://www.linkedin.com/jobs/view/4483903205/","date_posted":"2026-10-30","salary":"","ats":"LinkedIn","remote_query":true,"description":"Monde Nissin Corporation in Laguna, Philippines seeks an OSH professional to develop, implement, and monitor safety, health, and environmental programs ensuring regulatory compliance and company standards. The role focuses on promoting a safe workplace while minimizing environmental impact.\n\nThe candidate should hold a BOSH Certification and preferably a DOLE Accredited OSH Practitioner, with 3–5 years in manufacturing and strong collaboration skills.\n\nShow more\n\nShow less\n\nSeniority level\n\nNot Applicable\n\nEmployment type\n\nFull-time\n\nIndustries\n\nFood and Beverage Services","first_seen":"2026-10-30T20:20:41Z"}],"updated":[]}