{"run_at":"2026-10-25T19:44:43Z","source":"linkedin","added":[{"company":"Broadbent & Associates, Inc.","title":"SENIOR GEOLOGIST / ENVIRONMENTAL SCIENTIST","location":"Henderson, NV","url":"https://www.linkedin.com/jobs/view/4483391768/","date_posted":"2026-10-25","salary":"","ats":"LinkedIn","remote_query":true,"description":"Senior Geologist / Environmental Scientist\n\nBroadbent & Associates, Inc. is seeking a Senior Geologist to manage environmental projects in Nevada. This position combines technical expertise, regulatory coordination, project management, staff development, and client service.\n\nThe successful candidate will manage projects from initial scoping through investigation, remediation, regulatory closure, and closeout. Primary responsibilities will include petroleum release investigations, Underground Storage Tank (UST) sites, Petroleum Fund projects, Phase II Environmental Site Assessments (ESA), evaluation of environmental data relative to regulatory requirements, preparation and review of clear, technically sound project reports, and mentoring junior project managers.\n\nCompany Overview\n\nBroadbent is an environmental remediation, water resources, and civil engineering firm founded in 1987. The firm serves energy companies, mining operations, municipalities, developers, and government agencies throughout the United States. Broadbent provides practical, cost-effective solutions supported by technical expertise and responsive client service.\n\nPrimary Responsibilities\n\nManage environmental assessment, investigation, and remediation projects from proposal development through regulatory closure.\nPrepare project scopes, proposals, cost estimates, work plans, schedules, and budgets.\nManage Nevada petroleum release and UST projects, including projects eligible for Petroleum Fund reimbursement.\nPrepare and review Petroleum Fund cost estimates, reimbursement packages, change order requests, and supporting documentation.\nCoordinate with NDEP, clients, property owners, laboratories, subcontractors, and other project stakeholders.\nPlan and oversee soil, groundwater, soil gas, and other environmental investigations.\nEvaluate geological, hydrogeological, and analytical data to define the nature and extent of contamination and support corrective action decisions.\nPrepare and review investigation reports, corrective action plans, remediation work plans, monitoring reports, regulatory correspondence, and closure requests.\nDevelop and refine conceptual site models (CSMs) using site history, field observations, analytical results, geology, hydrogeology, and contaminant distribution.\nManage project scope, schedule, budget, invoicing, subcontractors, and deliverables.\nServe as a primary client contact and communicate project status, findings, regulatory requirements, and recommendations.\nMentor junior staff and provide technical direction related to field activities, data evaluation, and report preparation.\nSupport business development through client relationship management.\n\nMinimum Qualifications\n\nBachelor's degree in geology, hydrogeology, environmental science, engineering, or a related field.\nCurrent Nevada Certified Environmental Manager (CEM) preferred. Candidates licensed as a Professional Geologist (PG) or Registered Geologist (RG) must be eligible and willing to obtain a Nevada CEM within the first year of employment.\nFifteen or more years of progressively responsible environmental consulting experience.\nWorking knowledge of Nevada environmental regulations and experience coordinating with the Nevada Division of Environmental Protection (NDEP).\nExperience developing project scopes, cost estimates, proposals, technical reports, schedules, budgets, and Nevada Petroleum Fund documentation.\nDemonstrated ability to manage multiple projects while meeting scope, schedule, budget, and deliverable requirements.\nStrong technical writing, problem-solving, organizational, and communication skills.\nAbility to direct field personnel, laboratories, and subcontractors.\nAbility to travel within Nevada and surrounding areas with occasional overnight assignments.\n\nCompensation And Benefits\n\nBroadbent offers a competitive salary based on experience and a comprehensive benefits package that includes:\n\n100 percent employer paid medical premium\nDental and vision coverage\nHealth savings account with annual employer contribution\n401(k) with safe harbor contribution and company match\nPaid vacation and sick leave\nLife insurance\nBonus program\nOpportunities for professional growth and advancement\n\nWork Schedule\n\nThis is a full-time position with a typical Monday through Friday schedule. Periodic travel, overnight assignments, and field efforts may be required based on project needs.\n\nBroadbent is an Equal Opportunity/Affirmative Action employer. Qualified applicants will receive consideration for employment without regard to any characteristic protected by applicable federal, state, or local law.\n\nJob Posted by ApplicantPro\n\nShow more\n\nShow less\n\nSeniority level\n\nNot Applicable\n\nEmployment type\n\nFull-time\n\nIndustries\n\nEnvironmental Services","first_seen":"2026-10-25T19:44:43Z"}],"updated":[]}