{"run_at":"2026-10-26T06:43:14Z","source":"linkedin","added":[{"company":"APTIM","title":"Environmental Chemist","location":"San Diego, CA","url":"https://www.linkedin.com/jobs/view/4483522749/","date_posted":"2026-10-26","salary":"$35.00 to $40.00 per hour","ats":"LinkedIn","remote_query":true,"description":"Job Overview\n\nThe APTIM Federal Services, LLC team is seeking a Field Chemist to support an existing project team at our Hunters Point Naval Shipyard Project in San Francisco, California along with other projects in and out of the Bay area as well as California in general. This position will support a variety of Field and Office/Remote Chemistry-related tasks on all phases of project activities. Environmental Laboratory experience is desired, but not a requirement.\n\nKey Responsibilities/Accountabilities\n\nPlanning and oversight and/or completion of on-site sample collection and packaging and shipping of samples\nCoordinating with subcontract laboratories\nInterpretation/evaluation and verification/validation of chemical data\nAssist in the development of plans, including selection of sampling and analyses methods\nData tracking and evaluations against project criteria\nPreparation of procedures and reports related to sample/data collection and results\nCommunication of data and comparison to decision-limits to project teams, including client and/or regulator entities, ensuring conformance to applicable technical standards as well as company policies and procedures\nParticipation in project planning and execution should results indicate additional action is required\n\nBasic Qualifications\n\nAbility to work individually as well as cooperatively and be an important member of a remediation field team\nAbility to prioritize assignments and work independently with minimal guidance\nMay act as a resource for colleagues with less experience\nMonitor and control costs within own work. Solve moderately complex problems; take a new perspective on existing solutions\nManage own time to meet agreed targets\nAbility to work outside in all weather conditions and on sites where hazards are present and PPE is required\nAble to lift up to 40lbs\nPossess ability to explain difficult issues, develop and plan solutions, and work to establish consensus\nPromote teamwork; coaches and guides others.\nPossess a BS Degree in Chemistry or other Environmental/Physical Science discipline\nLooking for 1-3 years relevant experience, with experience in environmental investigation/remediation sampling and analysis a plus.\n\nAbout APTIM\n\nAPTIM enhances the quality of the environment, wellbeing of people, resilience of communities, and opportunity for employees to make a difference, not just a living. A leading professional solutions firm, we specialize in environmental, sustainability, resilience, and infrastructure solutions. Our team of experts provide these integrated solutions for forward-thinking government agencies, commercial and industrial clients, and energy customers. Together, we create sustainable and resilient communities for all.\n\nWhat You Can Expect From APTIM\n\nWork that is worthy of your time and talent\nRespect and flexibility to live a full life at work and at home\nDogged determination to deliver for our clients and communities\nA voice in making our company better\nInvestment into your personal and professional development\n\nAs of the date of this posting, a good faith estimate of the current pay range for this position is $35.00 to $40.00 per hour. Compensation depends on several factors including: experience, education, key skills, geographic location of the position, client requirements, external market competitiveness, and internal equity among other employees within APTIM.\n\nEmployee Benefits\n\nAPTIM Federal Services, LLC is committed to providing an extensive range of benefits that protect and promote the health and financial well-being of our employees and their families through the APTIM Benefits Marketplace https://aptim.makeityoursource.com/.\n\nMedical, vision, and dental insurance: Through the marketplace, our employees can choose benefits from five metallic levels and several carriers to find the right benefits that work for them in their location.\nCompany paid and optional Life insurance\nShort-term and long-term disability insurance\nAccident, Critical Illness, and Hospital Indemnity coverage\nPaid holidays, vacation, and sick leave (eligibility based on company policy and applicable law)\n401(k) APTIM offers three 401k plans through the Aon Pooled Employer Plan (PEP). The specific plan you are eligible for depends on the business unit you are in. The details of the largest plan are found here:\nAPTIM 401(k) Guide\nAPTIM - Helpful Documents\n\nWatch Our Video\n\nAbout APTIM - In Pursuit of Better\n\nShow more\n\nShow less\n\nSeniority level\n\nNot Applicable\n\nEmployment type\n\nFull-time\n\nIndustries\n\nEnvironmental Services","first_seen":"2026-10-26T06:43:14Z"}],"updated":[]}