{"run_at":"2026-10-29T07:28:40Z","source":"linkedin","added":[{"company":"Veolia | North America","title":"Environmental Specialist II","location":"Huntington Beach, CA","url":"https://www.linkedin.com/jobs/view/4482861050/","date_posted":"2026-10-29","salary":"$27 to $29 per hour","ats":"LinkedIn","remote_query":false,"description":"Company Description\n\nVeolia in North America is the top-ranked environmental company in the United States for three consecutive years, and the country's largest private water operator and technology provider as well as hazardous waste and pollution treatment leader. It offers a full spectrum of water, waste, and energy management services, including water and wastewater treatment, commercial and hazardous waste collection and disposal, energy consulting and resource recovery. Veolia helps commercial, industrial, healthcare, higher education and municipality customers throughout North America. Headquartered in Boston, Veolia has more than 10,000 employees working at more than 350 locations across North America.\n\nJob Description\n\nThis position reports directly to a customer site in Aliso Viejo, CA.\n\nPosition Purpose\n\nThis position provides specialized transportation and disposal services to our clients. Responsibilities include manifesting, packaging, spill clean-up response and remedial activities, labeling, loading, off loading & coordinating transportation, and sampling/profiling material while adhering to state and federal environmental, health, and safety regulations.\n\nPrimary Duties/Responsibilities\n\nSample and profile waste streams according to prescribed policies and procedures.\nManifesting, packaging, spill clean-up response and remedial activities, labeling, loading, off loading & coordinating transportation.\nKnowledge of disposal site capabilities and limitations prior to shipment to ensure efficient disbursement and storage.\nMaintain a professional image to clients by answering inquiries and suggesting solutions to existing/potential problems.\nComply and enforce all compliance, health, safety, and procedures in accordance with VES-TS policies.\nEnsure completion of all paperwork in compliance with U. S. Department of Transportation (DOT)/Environmental Protection Agency (EPA) regulations and VES-TS policies and procedures.\nOperate and maintain all equipment in a professional manner to ensure optimum efficiency and effectiveness to completion of project(s) in a timely manner.\nOther duties as assigned.\n\nQualifications\n\nEducation/Experience/Background:\n\nHigh School diploma or General Educational Development (GED) required\nBachelor's degree in Chemistry or a related science discipline preferred\nPrior work experience in the hazardous waste/related industry required\n\nKnowledge/Skills/Abilities\n\nStrong team player\nExcellent interpersonal and communication skills\nTime management: the ability to organize and manage multiple deadlines\nStrong customer service orientation\nComputer proficiency\nAbility to follow through on assignments.\n\nRequired Certification/Licenses/Training\n\n40-hour HAZWOPER Certification\nA valid Driver's License\nAbility to obtain a Class A or B Commercial Drivers License (CDL) with Hazardous (H) endorsement\nEnvironmental Specialist II Competency Test\n\nAdditional Information\n\nPay Range:\n$27 to $29 per hour\n\nBenefits:\nVeolia's comprehensive benefits package includes paid time off policies, as well as health, dental, vision, life insurance, savings accounts, tuition reimbursement, paid volunteering and more. In addition, employees are also entitled to participate in an employer sponsored 401(k) plan, to save for retirement.\n\nWe are an Equal Opportunity Employer! All qualified applicants will receive consideration for employment without regard to race, color, religion, sex, sexual orientation, gender identity, national origin, disability or protected veteran status.\n\nDisclaimer: The salary, other compensation, and benefits information is accurate as of the date of this posting. The Company reserves the right to modify this information at any time, subject to applicable law.\n\nBy clicking the link above or any third-party link within this posting, you are leaving this site and going to a third-party website where the third-party website's terms and privacy policy apply\n\nShow more\n\nShow less\n\nSeniority level\n\nNot Applicable\n\nEmployment type\n\nFull-time\n\nIndustries\n\nEnvironmental Services","first_seen":"2026-10-29T07:28:40Z"}],"updated":[]}